{"schema_version":"PS-COHORT-LIVENESS-2.5-2","protocol_version":"2.5","task_network_plan_id":"0aa341106cfc5b104ab9ca9c2ae116d490a258685e28d26d5435860c53bb12aa","cohort_id":"CAL-BR-012-v25-4ca0dec6","generation_seq":12,"generation_root_sha":"4ca0dec6e60566fd2c14dd003bf0839b91e30c2f","control_manifest_id":"CTRL-CAL-BR-012-v25-4ca0dec6","control_manifest_git_identity":"50c8243c6857b07763e7637868cc062e42cb30ce","assignment_id":"PS-BRANCH-CAL-BR-012-v25-4ca0dec6","assignment_git_identity":"13612b63ca2035b5b0943d52d4c6ec5ac273057c","lanes":[{"lane_id":"MF01","branch":"ps/work/CAL-BR-012-v25-4ca0dec6/MF01","path":"reports/CAL-BR-012-v25-4ca0dec6/MF01.json","expected_window_start_utc":"2026-08-23T05:05:00Z","deadline_utc":"2026-08-23T06:05:00Z","eligible_before_deadline":true},{"lane_id":"MF02","branch":"ps/work/CAL-BR-012-v25-4ca0dec6/MF02","path":"reports/CAL-BR-012-v25-4ca0dec6/MF02.json","expected_window_start_utc":"2026-08-23T05:06:00Z","deadline_utc":"2026-08-23T06:05:00Z","eligible_before_deadline":true},{"lane_id":"MF03","branch":"ps/work/CAL-BR-012-v25-4ca0dec6/MF03","path":"reports/CAL-BR-012-v25-4ca0dec6/MF03.json","expected_window_start_utc":"2026-08-23T05:07:00Z","deadline_utc":"2026-08-23T06:05:00Z","eligible_before_deadline":true},{"lane_id":"MF04","branch":"ps/work/CAL-BR-012-v25-4ca0dec6/MF04","path":"reports/CAL-BR-012-v25-4ca0dec6/MF04.json","expected_window_start_utc":"2026-08-23T05:08:00Z","deadline_utc":"2026-08-23T06:05:00Z","eligible_before_deadline":true},{"lane_id":"MF05","branch":"ps/work/CAL-BR-012-v25-4ca0dec6/MF05","path":"reports/CAL-BR-012-v25-4ca0dec6/MF05.json","expected_window_start_utc":"2026-08-23T05:09:00Z","deadline_utc":"2026-08-23T06:05:00Z","eligible_before_deadline":true},{"lane_id":"MM01","branch":"ps/work/CAL-BR-012-v25-4ca0dec6/MM01","path":"reports/CAL-BR-012-v25-4ca0dec6/MM01.json","expected_window_start_utc":"2026-08-23T05:10:00Z","deadline_utc":"2026-08-23T06:05:00Z","eligible_before_deadline":true},{"lane_id":"MM02","branch":"ps/work/CAL-BR-012-v25-4ca0dec6/MM02","path":"reports/CAL-BR-012-v25-4ca0dec6/MM02.json","expected_window_start_utc":"2026-08-23T05:11:00Z","deadline_utc":"2026-08-23T06:05:00Z","eligible_before_deadline":true},{"lane_id":"MM03","branch":"ps/work/CAL-BR-012-v25-4ca0dec6/MM03","path":"reports/CAL-BR-012-v25-4ca0dec6/MM03.json","expected_window_start_utc":"2026-08-23T05:12:00Z","deadline_utc":"2026-08-23T06:05:00Z","eligible_before_deadline":true},{"lane_id":"MM04","branch":"ps/work/CAL-BR-012-v25-4ca0dec6/MM04","path":"reports/CAL-BR-012-v25-4ca0dec6/MM04.json","expected_window_start_utc":"2026-08-23T05:13:00Z","deadline_utc":"2026-08-23T06:05:00Z","eligible_before_deadline":true},{"lane_id":"MM05","branch":"ps/work/CAL-BR-012-v25-4ca0dec6/MM05","path":"reports/CAL-BR-012-v25-4ca0dec6/MM05.json","expected_window_start_utc":"2026-08-23T05:14:00Z","deadline_utc":"2026-08-23T06:05:00Z","eligible_before_deadline":true},{"lane_id":"MM07","branch":"ps/work/CAL-BR-012-v25-4ca0dec6/MM07","path":"reports/CAL-BR-012-v25-4ca0dec6/MM07.json","expected_window_start_utc":"2026-08-23T05:15:00Z","deadline_utc":"2026-08-23T06:05:00Z","eligible_before_deadline":true},{"lane_id":"EXT01","branch":"ps/work/CAL-BR-012-v25-4ca0dec6/EXT01","path":"reports/CAL-BR-012-v25-4ca0dec6/EXT01.json","expected_window_start_utc":"2026-08-23T05:16:00Z","deadline_utc":"2026-08-23T06:05:00Z","eligible_before_deadline":true}]}
